datetime,label,author_name,message,cleaned_message
2026-03-15 8:00:00,,Siswa01,selamat pagi pak izin menyimak materinya,selamat pagi pak izin menyimak materinya
2026-03-15 8:05:00,,SpamBot1,INFO POLA GACOR RTP 99% MAXWIN MALAM INI CUS DAFTAR,info pola gacor rtp persen maxwin malam ini cus daftar
2026-03-15 8:10:00,,UserC,bang bahas materi tentang sistem terdistribusi dong,bang bahas materi tentang sistem terdistribusi dong
2026-03-15 8:15:00,,BotJudol,LINK SITUS RESMI ANTI RUNGKAD DEPO 10K PASTI WD,link situs resmi anti rungkad depo pasti wd
2026-03-15 8:20:00,,UserD,suaranya agak kecil bang coba cek mic nya,suaranya agak kecil bang coba cek mic nya